workflow_id,workflow_description,video_count,total_keyword_matches,total_phrase_matches,supporting_topic_ids,example_video_ids,example_titles,processed_at
research_paper_to_backtest_workflow,"Identify mentions of finding papers, reading claims, replicating strategy logic, coding a test, and validating results.",42,13,13,"research_paper_replication,backtesting_and_validation,ai_assisted_research_workflow","-2-vE-EbqBI,-lZbWrPiyWU,2oeNOkEPpdI","Is it really TRUE that ORDERFLOW trading cannot be AUTOMATED? | Fabio Valentini Exposed ? #trading #trader #orderflow #algotrading #strategytrading | Read papers or extract the findings using ChatGPT, trade them #trading #trader",2026-05-21T16:13:48.514059
market_inefficiency_hypothesis_workflow,Identify market structure or institutional constraint ideas that can become research hypotheses.,56,33,33,"market_structure_inefficiency,execution_and_microstructure,crypto_market_structure","-2-vE-EbqBI,-lZbWrPiyWU,0Pdp0d0siYE",Is it really TRUE that ORDERFLOW trading cannot be AUTOMATED? | Fabio Valentini Exposed ? #trading #trader #orderflow #algotrading #strategytrading | We got our first trade in and… here all the considerations#trading #trader #daytrading #stockmarket,2026-05-21T16:13:48.514072
risk_first_strategy_review_workflow,Identify risk-management-first thinking before any strategy is promoted.,59,52,52,"risk_management,options_and_protection,trading_psychology_and_process","-2-vE-EbqBI,-4H1e2tFovA,-HSpxk3HB60",Is it really TRUE that ORDERFLOW trading cannot be AUTOMATED? | #trading #trader #daytrading #finance #strategytrading | How to take advantage of the VIX. A simple way not discussed enough #stocks #trading #optionstrading,2026-05-21T16:13:48.514082
execution_microstructure_review_workflow,"Identify execution, slippage, volume, spread, VWAP, liquidity, and fill-quality considerations.",29,37,37,execution_and_microstructure,"-2-vE-EbqBI,0Pdp0d0siYE,6wDvV4cEN-o",Is it really TRUE that ORDERFLOW trading cannot be AUTOMATED? | We got our first trade in and… here all the considerations#trading #trader #daytrading #stockmarket | Video out today at 11 ET #trading #trader #daytrading #orderflow #algotrading,2026-05-21T16:13:48.514089
ai_assisted_quant_learning_workflow,"Identify places where AI, coding, prompts, automation, or research assistants could help learning without bypassing validation.",52,38,38,"ai_assisted_research_workflow,workstation_candidate_workflow","-2-vE-EbqBI,-4H1e2tFovA,-lZbWrPiyWU",Is it really TRUE that ORDERFLOW trading cannot be AUTOMATED? | #trading #trader #daytrading #finance #strategytrading | Fabio Valentini Exposed ? #trading #trader #orderflow #algotrading #strategytrading,2026-05-21T16:13:48.514096
workstation_module_candidate_workflow,Identify workflow fragments that could later become Local AI Workstation features.,56,43,43,"workstation_candidate_workflow,backtesting_and_validation,ai_assisted_research_workflow","-2-vE-EbqBI,-4H1e2tFovA,-lZbWrPiyWU",Is it really TRUE that ORDERFLOW trading cannot be AUTOMATED? | #trading #trader #daytrading #finance #strategytrading | Fabio Valentini Exposed ? #trading #trader #orderflow #algotrading #strategytrading,2026-05-21T16:13:48.514102
psychological_process_and_discipline_workflow,Identify learning/process/discipline/journaling routines.,18,20,20,trading_psychology_and_process,"-2-vE-EbqBI,-4H1e2tFovA,3zfggSLgJLg","Is it really TRUE that ORDERFLOW trading cannot be AUTOMATED? | #trading #trader #daytrading #finance #strategytrading | If you can’t code you cannot automate your #trading  strategy , thankfully ChatGPT can help you",2026-05-21T16:13:48.514108
unknown_or_low_confidence_workflow,Catch videos where deterministic matching does not confidently map to a workflow.,51,0,0,,"0TdmHjQyyBo,0XsMRxdl930,18k3N11DBNY","Treat trading like a business, basing your decisions purely on data and not gut feelings #trading | The more you trade the more commissions they make #trading #trader #daytrading | Technology evolves and retail traders are waking up #trading #trader #stocks #stockmarket",2026-05-21T16:13:48.514114
